{
  "schema": 1,
  "id": "2026-09-29-v3-factory-implementation-4e22",
  "title": "v3 factory implementation",
  "branch": "agent/v3-factory",
  "task": {
    "source": "docs/V3-PLAN.md",
    "class": "feature",
    "size": "large"
  },
  "harness": "claude-code",
  "model": {
    "tier": "frontier",
    "id": "claude-opus-5-5",
    "rule": "large"
  },
  "beats": {
    "triage": {
      "decision": "spec"
    },
    "spec": {
      "path": "docs/V3-PLAN.md",
      "approved": true
    },
    "isolate": {
      "worktree": "../wt/software-factory-v3",
      "branch": "agent/v3-factory"
    },
    "prove": {
      "before_captured": true,
      "evidence": [
        "test-suite",
        "output-pair"
      ]
    },
    "ship": {
      "pr": 2,
      "review_rounds": 1
    }
  },
  "memories": {
    "used": [],
    "written": []
  },
  "human_touches": [
    {
      "beat": "spec",
      "kind": "approval",
      "ref": null,
      "note": "User replied 'implement the plan' to docs/V3-PLAN.md",
      "at": "2026-09-29T15:10:25Z"
    },
    {
      "beat": "ship",
      "kind": "correction",
      "ref": "https://github.com/aditya-deokar/software-factory/pull/2#discussion_r4136284553",
      "note": "Greptile P1: drive paths resolved against cwd on Linux",
      "at": "2026-09-29T17:16:10Z"
    }
  ],
  "cost": null,
  "started_at": "2026-09-29T15:10:18Z",
  "finished_at": null,
  "outcome": null
}
